volume	publisher	title	first_author	BL_DLS_ID	pubplace	book_identifier	ARK_id_of_book	date	flickr_url	image_idx	page	flickr_id	flickr_small_source	flickr_small_height	flickr_small_width	flickr_medium_source	flickr_medium_height	flickr_medium_width	flickr_large_source	flickr_large_height	flickr_large_width	flickr_original_source	flickr_original_height	flickr_original_width
0	Printed at you may go look	[A Tragi-Comedy [in one act and in prose], called New-Market Fayre, or a Parliament out-cry of state-commodities, set to sale. (The second part of the Tragi-Comedy, called New-Market-Fayre [in five acts and in prose]. Or Mrs Parliament's new figaryes. Written by the Man in the Moon.)]			London?]	002644654		1649	http://www.flickr.com/photos/britishlibrary/11046633634	1	000009	11046633634	http://farm3.staticflickr.com/2828/11046633634_d779193642_m.jpg	55	240	http://farm3.staticflickr.com/2828/11046633634_d779193642.jpg	115	500	http://farm3.staticflickr.com/2828/11046633634_d779193642_b.jpg	236	1024	http://farm3.staticflickr.com/2828/11046633634_3f14f84c87_o.jpg	293	1273
0		A Bartholomew Fairing, new, new, new: sent from the raised siege before Dublin as a preparatory present to the great thanksgiving day. To be communicated onely to Independents. [A satirical drama, chiefly in prose.]			London	000215595		1649	http://www.flickr.com/photos/britishlibrary/10997400085	1	000009	10997400085	http://farm4.staticflickr.com/3748/10997400085_b01e1c4749_m.jpg	17	240	http://farm4.staticflickr.com/3748/10997400085_b01e1c4749.jpg	36	500	http://farm4.staticflickr.com/3748/10997400085_b01e1c4749_b.jpg	74	1024	http://farm4.staticflickr.com/3748/10997400085_a67541aa74_o.jpg	107	1483
0		The Virgin Widow. A Comedie [in five acts, in prose and verse]	QUARLES, Francis.		London	003014686		1649	http://www.flickr.com/photos/britishlibrary/10997400335	1	000007	10997400335	http://farm4.staticflickr.com/3802/10997400335_9c92a03df9_m.jpg	240	223	http://farm4.staticflickr.com/3802/10997400335_9c92a03df9.jpg	487	453				http://farm4.staticflickr.com/3802/10997400335_ea81bc935a_o.jpg	487	453
0		The Virgin Widow. A Comedie [in five acts, in prose and verse]	QUARLES, Francis.		London	003014686		1649	http://www.flickr.com/photos/britishlibrary/10997483186	1	000009	10997483186	http://farm4.staticflickr.com/3676/10997483186_d763cf0ddc_m.jpg	233	240	http://farm4.staticflickr.com/3676/10997483186_d763cf0ddc.jpg	351	361				http://farm4.staticflickr.com/3676/10997483186_064165a274_o.jpg	351	361
0	Hum. Robinson & Hum. Moseley	Love and Honour ... Presented by His Majesties Servants at the Black-Fryers. [In verse.]	DAVENANT, William Sir		London	000871551		1649	http://www.flickr.com/photos/britishlibrary/10997399075	1	000009	10997399075	http://farm4.staticflickr.com/3732/10997399075_d68627421b_m.jpg	35	240	http://farm4.staticflickr.com/3732/10997399075_d68627421b.jpg	72	500	http://farm4.staticflickr.com/3732/10997399075_d68627421b_b.jpg	148	1024	http://farm4.staticflickr.com/3732/10997399075_15aa5fa90c_o.jpg	217	1497
0	Hum. Robinson & Hum. Moseley	Love and Honour ... Presented by His Majesties Servants at the Black-Fryers. [In verse.]	DAVENANT, William Sir		London	000871551		1649	http://www.flickr.com/photos/britishlibrary/10997557854	1	000007	10997557854	http://farm6.staticflickr.com/5490/10997557854_b7bb35b29d_m.jpg	101	240	http://farm6.staticflickr.com/5490/10997557854_b7bb35b29d.jpg	198	472				http://farm6.staticflickr.com/5490/10997557854_db54e450af_o.jpg	198	472
0		A Bartholomew Fairing, new, new, new: sent from the raised siege before Dublin as a preparatory present to the great thanksgiving day. To be communicated onely to Independents. [A satirical drama, chiefly in prose.]			London	000215595		1649	http://www.flickr.com/photos/britishlibrary/10997612733	1	000007	10997612733	http://farm8.staticflickr.com/7307/10997612733_705b3ceea5_m.jpg	138	240	http://farm8.staticflickr.com/7307/10997612733_705b3ceea5.jpg	242	421				http://farm8.staticflickr.com/7307/10997612733_836b7e5499_o.jpg	242	421
