flickr_id	flickr_url	book_identifier	title	first_author	pubplace	publisher	date	volume	page	image_idx	ARK_id_of_book	BL_DLS_ID
11219072155	http://www.flickr.com/photos/britishlibrary/11219072155	002167252	Of active and retired Life, an epistle [in verse]		London		1735	0	000003	1		
11219087876	http://www.flickr.com/photos/britishlibrary/11219087876	000664462	The Works of King Charles I., both civil and sacred. With the life and reign of that Prince [by Peter Heylyn]	Charles I, King of England	London	T. Read	1735	0	000053	1		
11219188803	http://www.flickr.com/photos/britishlibrary/11219188803	003259086	The Volunteer Laureat. [A poem.] ... Inscribed to her Majesty, on her birthday. ... Number iv. For the year 1735, etc	SAVAGE, Richard.	London		1735	0	000005	1		
11219072454	http://www.flickr.com/photos/britishlibrary/11219072454	002452740	Merlin: a poem ... To which is added, The Royal Hermitage: a poem. Both by a Lady. [Subscribed, Melissa.]		London		1735	0	000003	1		
11219070815	http://www.flickr.com/photos/britishlibrary/11219070815	000954262	The Female Speaker; or, the priests in the wrong: a poem. Being an epistle from the celebrated Mrs. D--mm--d [Drummond] to Dr. St---b---g [Stebbing] and Mr. F---t---r [Foster]. Occasioned by their dispute on the subject of heresy	DRUMMOND Mrs. Sister of Provost Drummond of Edinburgh	London	B. Dickinson	1735	0	000005	1		
11219070095	http://www.flickr.com/photos/britishlibrary/11219070095	000664462	The Works of King Charles I., both civil and sacred. With the life and reign of that Prince [by Peter Heylyn]	Charles I, King of England	London	T. Read	1735	0	000011	1		
