volume	publisher	title	first_author	BL_DLS_ID	pubplace	book_identifier	ARK_id_of_book	date	flickr_url	image_idx	page	flickr_id	flickr_small_source	flickr_small_height	flickr_small_width	flickr_medium_source	flickr_medium_height	flickr_medium_width	flickr_large_source	flickr_large_height	flickr_large_width	flickr_original_source	flickr_original_height	flickr_original_width
0	Printed for the Author	The Visitation; or, an interview between the Ghost of Shakespear and D-v-d G-rr-k [i.e. David Garrick], Esq	Shakespeare, William	lsidyv32bb0ab5	London	003355111	ark:/81055/vdc_000000051DCE	1755	http://www.flickr.com/photos/britishlibrary/11219130906	1	000028	11219130906	http://farm6.staticflickr.com/5543/11219130906_78d5c37a0e_m.jpg	240	118	http://farm6.staticflickr.com/5543/11219130906_78d5c37a0e.jpg	500	245	http://farm6.staticflickr.com/5543/11219130906_78d5c37a0e_b.jpg	1024	502	http://farm6.staticflickr.com/5543/11219130906_a68f928ec2_o.jpg	1843	903
0	Printed for the Author	The Visitation; or, an interview between the Ghost of Shakespear and D-v-d G-rr-k [i.e. David Garrick], Esq	Shakespeare, William	lsidyv32bb0ab5	London	003355111	ark:/81055/vdc_000000051DCE	1755	http://www.flickr.com/photos/britishlibrary/11219116804	1	000013	11219116804	http://farm3.staticflickr.com/2856/11219116804_9ab74bed18_m.jpg	82	240	http://farm3.staticflickr.com/2856/11219116804_9ab74bed18.jpg	170	500	http://farm3.staticflickr.com/2856/11219116804_9ab74bed18_b.jpg	348	1024	http://farm3.staticflickr.com/2856/11219116804_d3e92844b5_o.jpg	628	1846
0	S. Baker	Religious Conscience: or, the Morning and Evening Sacrifice. A poem. In imitation of Dr. Young's Night Thoughts	YOUNG, Edward the Poet		London	004001100		1755	http://www.flickr.com/photos/britishlibrary/11219115844	1	000007	11219115844	http://farm6.staticflickr.com/5525/11219115844_4ccd901d5b_m.jpg	65	240	http://farm6.staticflickr.com/5525/11219115844_4ccd901d5b.jpg	136	500	http://farm6.staticflickr.com/5525/11219115844_4ccd901d5b_b.jpg	278	1024	http://farm6.staticflickr.com/5525/11219115844_5558fa6ca8_o.jpg	542	1994
0		Two Poems presented to ... the Duke of Newcastle, Chancellor of the University of Cambridge, upon his ... revisiting that University ... to lay the first stone of the New-Building	MARRIOTT, James Sir		London	002390297		1755	http://www.flickr.com/photos/britishlibrary/11219115564	1	000003	11219115564	http://farm8.staticflickr.com/7404/11219115564_4cfe84db60_m.jpg	123	240	http://farm8.staticflickr.com/7404/11219115564_4cfe84db60.jpg	255	500	http://farm8.staticflickr.com/7404/11219115564_4cfe84db60_b.jpg	523	1024	http://farm8.staticflickr.com/7404/11219115564_dab93284bb_o.jpg	963	1886
0		Two Poems presented to ... the Duke of Newcastle, Chancellor of the University of Cambridge, upon his ... revisiting that University ... to lay the first stone of the New-Building	MARRIOTT, James Sir		London	002390297		1755	http://www.flickr.com/photos/britishlibrary/11219129116	1	000012	11219129116	http://farm4.staticflickr.com/3805/11219129116_fae1a1d7ac_m.jpg	113	240	http://farm4.staticflickr.com/3805/11219129116_fae1a1d7ac.jpg	235	500	http://farm4.staticflickr.com/3805/11219129116_fae1a1d7ac_b.jpg	482	1024	http://farm4.staticflickr.com/3805/11219129116_aebff11ae8_o.jpg	991	2104
0		Some Thoughts on Building and Planting, to Sir James Lowther, of Lowther-Hall, Bart. [In verse.]	LOWTHER, James Earl of Lonsdale			002273290		1755	http://www.flickr.com/photos/britishlibrary/11219128716	1	000009	11219128716	http://farm8.staticflickr.com/7325/11219128716_2e67a4ab7f_m.jpg	63	240	http://farm8.staticflickr.com/7325/11219128716_2e67a4ab7f.jpg	130	500	http://farm8.staticflickr.com/7325/11219128716_2e67a4ab7f_b.jpg	267	1024	http://farm8.staticflickr.com/7325/11219128716_0aee5a0f72_o.jpg	546	2096
0	J. Bentham	The Justice of the Supreme Being, a poem	BALLY, George.		Cambridge	000185529		1755	http://www.flickr.com/photos/britishlibrary/11219127906	1	000029	11219127906	http://farm4.staticflickr.com/3692/11219127906_b0a989eb9e_m.jpg	165	240	http://farm4.staticflickr.com/3692/11219127906_b0a989eb9e.jpg	344	500	http://farm4.staticflickr.com/3692/11219127906_b0a989eb9e_b.jpg	705	1024	http://farm4.staticflickr.com/3692/11219127906_2f49f2acb0_o.jpg	950	1380
0	J. & J. Rivington; R. & J. Dodsley	A Descriptive Poem, addressed to two Ladies, at their return from viewing the mines near Whitehaven. To which are added, some thoughts on building and planting, to Sir James Lowther, of Lowther Hall, Bart	DALTON, John D.D		London	000855797		1755	http://www.flickr.com/photos/britishlibrary/11219113954	1	000011	11219113954	http://farm6.staticflickr.com/5541/11219113954_278a4db178_m.jpg	68	240	http://farm6.staticflickr.com/5541/11219113954_278a4db178.jpg	142	500	http://farm6.staticflickr.com/5541/11219113954_278a4db178_b.jpg	291	1024	http://farm6.staticflickr.com/5541/11219113954_ee015a1ae3_o.jpg	581	2048
