flickr_id	flickr_url	book_identifier	title	first_author	pubplace	publisher	date	volume	page	image_idx	ARK_id_of_book	BL_DLS_ID
11047048284	http://www.flickr.com/photos/britishlibrary/11047048284	000382940	The American Coast Pilot ... from Passamaquoddy, through the Gulf of Florida ... together with the courses and distances from Cape Cod and Cape Ann ... to George's Bank ... Corrected and improved ... Ninth edition	BLUNT, Edmund March.	New-York	E. M. Blunt	1817	0	000145	1		
11047013656	http://www.flickr.com/photos/britishlibrary/11047013656	002921088	[Modern geography ... The astronomical introduction by M. La Croix ... Translated by John Pond ... The third edition, corrected, etc.]	PINKERTON, John Antiquary	London		1817	02	000259	1	ark:/81055/vdc_00000005E69E	lsidyv3e70bd35
11003712516	http://www.flickr.com/photos/britishlibrary/11003712516	000808915	An Historical Account of the Battle of Waterloo ... intended to elucidate the topographical plan, executed by W. B. Craan ... Translated ... with explanatory notes, by Captain Arthur Gore ... Embellished with accurate views of the principal places mentioned in the work	CRAAN, Willem Benjamin.	London	Samuel Leigh	1817	0	000068	1		
11003712166	http://www.flickr.com/photos/britishlibrary/11003712166	002383174	An account of the natives of the Tonga Islands in the South Pacific Ocean, with an original grammar of their language ... compiled ... from the ... communications of W. M. ... by J. Martin	MARINER, William of the Tonga Islands	London	J. Murray	1817	01	000010	1	ark:/81055/vdc_000000059B14	lsidyv3c5146a6
11003617505	http://www.flickr.com/photos/britishlibrary/11003617505	000382940	The American Coast Pilot ... from Passamaquoddy, through the Gulf of Florida ... together with the courses and distances from Cape Cod and Cape Ann ... to George's Bank ... Corrected and improved ... Ninth edition	BLUNT, Edmund March.	New-York	E. M. Blunt	1817	0	000168	1		
11003616815	http://www.flickr.com/photos/britishlibrary/11003616815	003104893	An Authentic Narrative of the loss of the American Brig Commerce, wrecked on the Western Coast of Africa, in the month of August 1815. With an account of the sufferings of her surviving officers and crew, ... and observations historical, geographical, etc	RILEY, James Captain	New York	Printed for the Author	1817	0	000580	1		
11003838443	http://www.flickr.com/photos/britishlibrary/11003838443	000843884	[Essay on the Theory of the Earth. Translated ... by Robert Kerr ... With mineralogical notes, and an account of Cuvier's geological discoveries, by Professor Jameson.]	Cuvier, Georges baron	Edinburgh	William Blackwood	1817	0	000330	1	ark:/81055/vdc_00000005E2F6	lsidyv3ccaafc7
11003615145	http://www.flickr.com/photos/britishlibrary/11003615145	000725989	A Topographical and Historical Description of the Parish of Tixall in the County of Stafford. [With plates.]	CLIFFORD, afterwards CLIFFORD CONSTABLE, Thomas Hugh Sir, Bart. and CLIFFORD (Arthur)	Paris	M. Nouzon	1817	0	000160	1	ark:/81055/vdc_0000000519AE	lsidyv2af754b0
11003837333	http://www.flickr.com/photos/britishlibrary/11003837333	002011198	[Travels in Brazil.]	KOSTER, Henry.	London		1817	0	000651	1		
11003707786	http://www.flickr.com/photos/britishlibrary/11003707786	001944207	A Full and Circumstantial Account of the Memorable Battle of Waterloo: the second restoration of Louis XVIII; and the deportation of Napoleon Buonaparte to the island of St. Helena and every recent particular relative to his conduct and mode of life in his exile. Together with an interesting account of the affairs of France, and biographical sketches of the most distinguished Waterloo heroes. Embellished with engravings	Kelly, Christopher.	London	Thomas Kelly	1817	0	000110	1		
11003707986	http://www.flickr.com/photos/britishlibrary/11003707986	001847338	[Journal of a tour in Germany, Sweden, Russia, Poland, during ... 1813 and 1814.]	JAMES, John Thomas Bishop of Calcutta	London		1817	02	000187	1	ark:/81055/vdc_000000053E74	lsidyv3bc2d746
11003772004	http://www.flickr.com/photos/britishlibrary/11003772004	001834444	Algiers; being a complete picture of the Barbary States ... and containing ... A narrative of the various attacks upon Algiers by the European States, etc. [With coloured illustrations]	JACKSON, George Anson.	London	R. Edwards	1817	0	000368	1	ark:/81055/vdc_000000059DDE	lsidyv3c553a59
11003706256	http://www.flickr.com/photos/britishlibrary/11003706256	002072869	[Voyages and travels in various parts of the world, during the years 1803-1807 ... Illustrated by engravings.]	LANGSDORF, Georg Heinrich von Baron	Carlisle [U.S.]		1817	0	000010	1	ark:/81055/vdc_000000052C02	lsidyv3b9b32c1
11003833293	http://www.flickr.com/photos/britishlibrary/11003833293	002921088	[Modern geography ... The astronomical introduction by M. La Croix ... Translated by John Pond ... The third edition, corrected, etc.]	PINKERTON, John Antiquary	London		1817	01	000543	1	ark:/81055/vdc_00000005E69E	lsidyv3e70bd35
11003833623	http://www.flickr.com/photos/britishlibrary/11003833623	002921088	[Modern geography ... The astronomical introduction by M. La Croix ... Translated by John Pond ... The third edition, corrected, etc.]	PINKERTON, John Antiquary	London		1817	02	000656	1	ark:/81055/vdc_00000005E69E	lsidyv3e70bd35
11003703296	http://www.flickr.com/photos/britishlibrary/11003703296	002322267	A new and complete System of Modern Geography ... With a brief sketch of the origin, history, and antiquities of each nation. Illustrated, etc	Mackenzie, E. (Eneas)	Newcastle upon Tyne	Mackenzie & Dent	1817	01	000615	1	ark:/81055/vdc_00000005C838	lsidyv3ca38433
11003609405	http://www.flickr.com/photos/britishlibrary/11003609405	002322267	A new and complete System of Modern Geography ... With a brief sketch of the origin, history, and antiquities of each nation. Illustrated, etc	Mackenzie, E. (Eneas)	Newcastle upon Tyne	Mackenzie & Dent	1817	02	000364	1	ark:/81055/vdc_00000005C838	lsidyv3ca38433
11003830053	http://www.flickr.com/photos/britishlibrary/11003830053	002322267	A new and complete System of Modern Geography ... With a brief sketch of the origin, history, and antiquities of each nation. Illustrated, etc	Mackenzie, E. (Eneas)	Newcastle upon Tyne	Mackenzie & Dent	1817	01	000234	1	ark:/81055/vdc_00000005C838	lsidyv3ca38433
11003829573	http://www.flickr.com/photos/britishlibrary/11003829573	002921088	[Modern geography ... The astronomical introduction by M. La Croix ... Translated by John Pond ... The third edition, corrected, etc.]	PINKERTON, John Antiquary	London		1817	02	000748	1	ark:/81055/vdc_00000005E69E	lsidyv3e70bd35
11003828903	http://www.flickr.com/photos/britishlibrary/11003828903	000479742	Norwich Cathedral Vade-Mecum. Antiquarian and architectural memoranda relating to Norwich Cathedral Church: embracing a brief historical and descriptive account of that edifice, with lists of bishops, etc	Britton, John	London	Printed for the Author	1817	0	000023	1	ark:/81055/vdc_0000000571D4	lsidyv3c1fa867
11003764684	http://www.flickr.com/photos/britishlibrary/11003764684	003851277	The Battle of Waterloo; a poem, in two parts. ... The embellishments are, a portrait of ... the Duke of Wellington, and eight ... plates; ... coloured, etc	WARDEN, C. F.	London		1817	0	000021	1		
11003699356	http://www.flickr.com/photos/britishlibrary/11003699356	001779550	[The History of Derby to the year 1791.]	HUTTON, William F.S.A. Sco	London	Nichols, Son, and Bentley	1817	0	000166	1		
11003604585	http://www.flickr.com/photos/britishlibrary/11003604585	002921088	[Modern geography ... The astronomical introduction by M. La Croix ... Translated by John Pond ... The third edition, corrected, etc.]	PINKERTON, John Antiquary	London		1817	02	000240	1	ark:/81055/vdc_00000005E69E	lsidyv3e70bd35
11003763694	http://www.flickr.com/photos/britishlibrary/11003763694	000808915	An Historical Account of the Battle of Waterloo ... intended to elucidate the topographical plan, executed by W. B. Craan ... Translated ... with explanatory notes, by Captain Arthur Gore ... Embellished with accurate views of the principal places mentioned in the work	CRAAN, Willem Benjamin.	London	Samuel Leigh	1817	0	000063	1		
11003696896	http://www.flickr.com/photos/britishlibrary/11003696896	002921088	[Modern geography ... The astronomical introduction by M. La Croix ... Translated by John Pond ... The third edition, corrected, etc.]	PINKERTON, John Antiquary	London		1817	01	000903	1	ark:/81055/vdc_00000005E69E	lsidyv3e70bd35
11003696256	http://www.flickr.com/photos/britishlibrary/11003696256	001944207	A Full and Circumstantial Account of the Memorable Battle of Waterloo: the second restoration of Louis XVIII; and the deportation of Napoleon Buonaparte to the island of St. Helena and every recent particular relative to his conduct and mode of life in his exile. Together with an interesting account of the affairs of France, and biographical sketches of the most distinguished Waterloo heroes. Embellished with engravings	Kelly, Christopher.	London	Thomas Kelly	1817	0	000513	1		
11003760744	http://www.flickr.com/photos/britishlibrary/11003760744	001847338	[Journal of a tour in Germany, Sweden, Russia, Poland, during ... 1813 and 1814.]	JAMES, John Thomas Bishop of Calcutta	London		1817	02	000351	1	ark:/81055/vdc_000000053E74	lsidyv3bc2d746
11003759784	http://www.flickr.com/photos/britishlibrary/11003759784	002921088	[Modern geography ... The astronomical introduction by M. La Croix ... Translated by John Pond ... The third edition, corrected, etc.]	PINKERTON, John Antiquary	London		1817	01	000127	1	ark:/81055/vdc_00000005E69E	lsidyv3e70bd35
11003759594	http://www.flickr.com/photos/britishlibrary/11003759594	000974223	Statement respecting the Earl of Selkirk's settlement of Kildonan, upon the Red River in North America: its destruction in the years 1815 and 1816; and the massacre of Governor Semple and his party	DOUGLAS, Thomas Earl of Selkirk	London		1817	0	000008	1		
11003599805	http://www.flickr.com/photos/britishlibrary/11003599805	003934144	An historical account of the rise and progress of the Bengal Native Infantry, from its first formation in 1757, to 1796, ... with a detail of the services on which the several battalions have been employed during that period [and an Appendix]	WILLIAMS, John Captain, Royal Army	London		1817	0	000184	1		
11003693396	http://www.flickr.com/photos/britishlibrary/11003693396	001779550	[The History of Derby to the year 1791.]	HUTTON, William F.S.A. Sco	London	Nichols, Son, and Bentley	1817	0	000168	1		
11003597405	http://www.flickr.com/photos/britishlibrary/11003597405	002921088	[Modern geography ... The astronomical introduction by M. La Croix ... Translated by John Pond ... The third edition, corrected, etc.]	PINKERTON, John Antiquary	London		1817	02	000318	1	ark:/81055/vdc_00000005E69E	lsidyv3e70bd35
11003820013	http://www.flickr.com/photos/britishlibrary/11003820013	003842704	Memoirs relating to European and Asiatic Turkey; edited from manuscript journals, by R. Walpole. (Travels in various countries of the East; being a continuation of Memoirs relating to European and Asiatic Turkey, &c.)	WALPOLE, Robert Rev	London	Longman & Co.	1817	01	000527	1	ark:/81055/vdc_000000056766	lsidyv3c13e360
11003690596	http://www.flickr.com/photos/britishlibrary/11003690596	001302991	History of the Wars since the French Revolution, from the commencement of hostilities in 1792, to the termination of the war ... after the memorable Battle of Waterloo in 1815; comprehending the civil, military and naval history of that most eventful period, and biographical sketches of public characters. Embellished with portraits ... and a plan of the battle of Waterloo		London		1817	02	000377	1		
11003596155	http://www.flickr.com/photos/britishlibrary/11003596155	000803915	The Pageant of the Company of Sheremen and Taylors, in Coventry, as performed by them on the festival of Corpus Christi; together with other pageants, exhibited on occasion of several royal visits to that city; and two specimens of ancient local poetry. [Edited by Thomas Sharp.]	CROO, Robert.	Coventry	W. Reader	1817	0	000008	1		
11003595795	http://www.flickr.com/photos/britishlibrary/11003595795	003934144	An historical account of the rise and progress of the Bengal Native Infantry, from its first formation in 1757, to 1796, ... with a detail of the services on which the several battalions have been employed during that period [and an Appendix]	WILLIAMS, John Captain, Royal Army	London		1817	0	000008	1		
11003753684	http://www.flickr.com/photos/britishlibrary/11003753684	001779563	[A Tour to Scarborough in 1803; including a Survey of the City of York.]	HUTTON, William F.S.A. Sco	London		1817	0	000008	1		
11003816303	http://www.flickr.com/photos/britishlibrary/11003816303	002328074	Narrative of a Voyage, in His Majesty's late ship Alceste, to the Yellow Sea, along the coast of Corea ... to the island of Lewchew, etc. [With plates.]	MACLEOD, John Surgeon, R.N	London	John Murray	1817	0	000090	1		
11003752854	http://www.flickr.com/photos/britishlibrary/11003752854	002541036	[Lalla Rookh, an oriental romance ... Third edition.]	MOORE, Thomas the Poet	London		1817	0	000347	1		
11003815023	http://www.flickr.com/photos/britishlibrary/11003815023	000382940	The American Coast Pilot ... from Passamaquoddy, through the Gulf of Florida ... together with the courses and distances from Cape Cod and Cape Ann ... to George's Bank ... Corrected and improved ... Ninth edition	BLUNT, Edmund March.	New-York	E. M. Blunt	1817	0	000198	1		
11003814093	http://www.flickr.com/photos/britishlibrary/11003814093	000021782	The Adventures of a Post Captain. By a Naval Officer. [In verse.] With ... engravings, by Mr. Williams	WILLIAMS, Samuel Wood Engraver	London	J. Johnston	1817	0	000107	1		
11003751414	http://www.flickr.com/photos/britishlibrary/11003751414	002649143	Illustrations of the Literary History of the Eighteenth Century, consisting of authentic memoir and original letters of eminent persons, and intended as a sequel to the “Literary Anecdotes.” [Vol. 7, 8 by J. B. Nichols.]	NICHOLS, John F.S.A., Printer	London	Nichols, Son, and Bentley	1817	01	000802	1	ark:/81055/vdc_00000005AED6	lsidyv3c6fa0b7
11003685456	http://www.flickr.com/photos/britishlibrary/11003685456	002011198	[Travels in Brazil.]	KOSTER, Henry.	London		1817	0	000344	1		
11003813223	http://www.flickr.com/photos/britishlibrary/11003813223	001847338	[Journal of a tour in Germany, Sweden, Russia, Poland, during ... 1813 and 1814.]	JAMES, John Thomas Bishop of Calcutta	London		1817	02	000407	1	ark:/81055/vdc_000000053E74	lsidyv3bc2d746
11003811363	http://www.flickr.com/photos/britishlibrary/11003811363	003842704	Memoirs relating to European and Asiatic Turkey; edited from manuscript journals, by R. Walpole. (Travels in various countries of the East; being a continuation of Memoirs relating to European and Asiatic Turkey, &c.)	WALPOLE, Robert Rev	London	Longman & Co.	1817	01	000010	1	ark:/81055/vdc_000000056766	lsidyv3c13e360
11003588595	http://www.flickr.com/photos/britishlibrary/11003588595	003104894	[An Authentic Narrative of the loss of the American Brig Commerce, wrecked on the Western Coast of Africa, in the month of August 1815. With an account of the sufferings of her surviving officers and crew, ... and observations historical, geographical, etc.]	RILEY, James Captain	Hartford [U.S.]	Published by the Author	1817	0	000101	1	ark:/81055/vdc_000000052350	lsidyv32bfc631
11003747224	http://www.flickr.com/photos/britishlibrary/11003747224	001944207	A Full and Circumstantial Account of the Memorable Battle of Waterloo: the second restoration of Louis XVIII; and the deportation of Napoleon Buonaparte to the island of St. Helena and every recent particular relative to his conduct and mode of life in his exile. Together with an interesting account of the affairs of France, and biographical sketches of the most distinguished Waterloo heroes. Embellished with engravings	Kelly, Christopher.	London	Thomas Kelly	1817	0	000053	1		
11003746924	http://www.flickr.com/photos/britishlibrary/11003746924	001408209	Description historique et statistique de la Ville de Reims, etc	GÉRUZEZ, Jean Baptiste François.	Reims		1817	01	000317	1		
11003808803	http://www.flickr.com/photos/britishlibrary/11003808803	001944207	A Full and Circumstantial Account of the Memorable Battle of Waterloo: the second restoration of Louis XVIII; and the deportation of Napoleon Buonaparte to the island of St. Helena and every recent particular relative to his conduct and mode of life in his exile. Together with an interesting account of the affairs of France, and biographical sketches of the most distinguished Waterloo heroes. Embellished with engravings	Kelly, Christopher.	London	Thomas Kelly	1817	0	000302	1		
11003586315	http://www.flickr.com/photos/britishlibrary/11003586315	002921088	[Modern geography ... The astronomical introduction by M. La Croix ... Translated by John Pond ... The third edition, corrected, etc.]	PINKERTON, John Antiquary	London		1817	02	000767	1	ark:/81055/vdc_00000005E69E	lsidyv3e70bd35
11003807753	http://www.flickr.com/photos/britishlibrary/11003807753	003842704	Memoirs relating to European and Asiatic Turkey; edited from manuscript journals, by R. Walpole. (Travels in various countries of the East; being a continuation of Memoirs relating to European and Asiatic Turkey, &c.)	WALPOLE, Robert Rev	London	Longman & Co.	1817	02	000479	1	ark:/81055/vdc_000000056766	lsidyv3c13e360
11003743244	http://www.flickr.com/photos/britishlibrary/11003743244	002921088	[Modern geography ... The astronomical introduction by M. La Croix ... Translated by John Pond ... The third edition, corrected, etc.]	PINKERTON, John Antiquary	London		1817	01	000370	1	ark:/81055/vdc_00000005E69E	lsidyv3e70bd35
11003678926	http://www.flickr.com/photos/britishlibrary/11003678926	001302991	History of the Wars since the French Revolution, from the commencement of hostilities in 1792, to the termination of the war ... after the memorable Battle of Waterloo in 1815; comprehending the civil, military and naval history of that most eventful period, and biographical sketches of public characters. Embellished with portraits ... and a plan of the battle of Waterloo		London		1817	01	000036	1		
11003677726	http://www.flickr.com/photos/britishlibrary/11003677726	002921088	[Modern geography ... The astronomical introduction by M. La Croix ... Translated by John Pond ... The third edition, corrected, etc.]	PINKERTON, John Antiquary	London		1817	01	000501	1	ark:/81055/vdc_00000005E69E	lsidyv3e70bd35
11003742134	http://www.flickr.com/photos/britishlibrary/11003742134	000200433	A Tour through Italy, Sicily, Istria, Carniola, the Tyrol, and Austria ... The second edition	BARING, T. Traveller	London	Gale & Fenner	1817	0	000010	1	ark:/81055/vdc_00000005C310	lsidyv3c9a4e0f
11003676286	http://www.flickr.com/photos/britishlibrary/11003676286	001779550	[The History of Derby to the year 1791.]	HUTTON, William F.S.A. Sco	London	Nichols, Son, and Bentley	1817	0	000194	1		
11003804133	http://www.flickr.com/photos/britishlibrary/11003804133	003842704	Memoirs relating to European and Asiatic Turkey; edited from manuscript journals, by R. Walpole. (Travels in various countries of the East; being a continuation of Memoirs relating to European and Asiatic Turkey, &c.)	WALPOLE, Robert Rev	London	Longman & Co.	1817	0	000182	1	ark:/81055/vdc_000000056766	lsidyv3c13e360
11003581135	http://www.flickr.com/photos/britishlibrary/11003581135	002921088	[Modern geography ... The astronomical introduction by M. La Croix ... Translated by John Pond ... The third edition, corrected, etc.]	PINKERTON, John Antiquary	London		1817	01	000008	1	ark:/81055/vdc_00000005E69E	lsidyv3e70bd35
11003802933	http://www.flickr.com/photos/britishlibrary/11003802933	002921088	[Modern geography ... The astronomical introduction by M. La Croix ... Translated by John Pond ... The third edition, corrected, etc.]	PINKERTON, John Antiquary	London		1817	02	000175	1	ark:/81055/vdc_00000005E69E	lsidyv3e70bd35
11003579335	http://www.flickr.com/photos/britishlibrary/11003579335	003842704	Memoirs relating to European and Asiatic Turkey; edited from manuscript journals, by R. Walpole. (Travels in various countries of the East; being a continuation of Memoirs relating to European and Asiatic Turkey, &c.)	WALPOLE, Robert Rev	London	Longman & Co.	1817	01	000179	1	ark:/81055/vdc_000000056766	lsidyv3c13e360
11003579235	http://www.flickr.com/photos/britishlibrary/11003579235	003842704	Memoirs relating to European and Asiatic Turkey; edited from manuscript journals, by R. Walpole. (Travels in various countries of the East; being a continuation of Memoirs relating to European and Asiatic Turkey, &c.)	WALPOLE, Robert Rev	London	Longman & Co.	1817	0	000620	1	ark:/81055/vdc_000000056766	lsidyv3c13e360
11003737224	http://www.flickr.com/photos/britishlibrary/11003737224	001641077	Sammlung von Nachrichten über die königliche freie Bergstadt Reichenstein in topographischer ... und statistischer Beziehung ... Mit Rissen und Kupfern	HEINTZE, Carl Benjamin.	Breslau		1817	0	000006	1		
11003577805	http://www.flickr.com/photos/britishlibrary/11003577805	002649143	Illustrations of the Literary History of the Eighteenth Century, consisting of authentic memoir and original letters of eminent persons, and intended as a sequel to the “Literary Anecdotes.” [Vol. 7, 8 by J. B. Nichols.]	NICHOLS, John F.S.A., Printer	London	Nichols, Son, and Bentley	1817	01	000244	1	ark:/81055/vdc_00000005AED6	lsidyv3c6fa0b7
11003799063	http://www.flickr.com/photos/britishlibrary/11003799063	001408209	Description historique et statistique de la Ville de Reims, etc	GÉRUZEZ, Jean Baptiste François.	Reims		1817	01	000356	1		
11003576785	http://www.flickr.com/photos/britishlibrary/11003576785	003104893	An Authentic Narrative of the loss of the American Brig Commerce, wrecked on the Western Coast of Africa, in the month of August 1815. With an account of the sufferings of her surviving officers and crew, ... and observations historical, geographical, etc	RILEY, James Captain	New York	Printed for the Author	1817	0	000335	1		
11003735504	http://www.flickr.com/photos/britishlibrary/11003735504	000021782	The Adventures of a Post Captain. By a Naval Officer. [In verse.] With ... engravings, by Mr. Williams	WILLIAMS, Samuel Wood Engraver	London	J. Johnston	1817	0	000133	1		
11003734334	http://www.flickr.com/photos/britishlibrary/11003734334	002322267	A new and complete System of Modern Geography ... With a brief sketch of the origin, history, and antiquities of each nation. Illustrated, etc	Mackenzie, E. (Eneas)	Newcastle upon Tyne	Mackenzie & Dent	1817	01	000548	1	ark:/81055/vdc_00000005C838	lsidyv3ca38433
11003574455	http://www.flickr.com/photos/britishlibrary/11003574455	003842704	Memoirs relating to European and Asiatic Turkey; edited from manuscript journals, by R. Walpole. (Travels in various countries of the East; being a continuation of Memoirs relating to European and Asiatic Turkey, &c.)	WALPOLE, Robert Rev	London	Longman & Co.	1817	0	000036	1	ark:/81055/vdc_000000056766	lsidyv3c13e360
11003732944	http://www.flickr.com/photos/britishlibrary/11003732944	001887109	A Journey to the Western Islands of Scotland ... With remarks by the Rev. Donald McNicol, etc. [With a portrait.]	Johnson, Samuel	Glasgow	R. Chapman	1817	0	000006	1	ark:/81055/vdc_00000005835C	lsidyv3c38a1cd
11003666766	http://www.flickr.com/photos/britishlibrary/11003666766	002101175	An historical and descriptive account of Leamington and Warwick; to which are added, short notices of the towns, villages, etc. within the circuit of ten miles. Abridged from a larger work (An historical and descriptive account of the town and Castle of Warwick, etc. [Signed, W. F., i.e., William Field.])	FIELD, William Minister of the Chapel in High Street, Warwick	Warwick		1817	0	000006	1		
11003731824	http://www.flickr.com/photos/britishlibrary/11003731824	002072869	[Voyages and travels in various parts of the world, during the years 1803-1807 ... Illustrated by engravings.]	LANGSDORF, Georg Heinrich von Baron	Carlisle [U.S.]		1817	0	000011	1	ark:/81055/vdc_000000052C02	lsidyv3b9b32c1
11003571745	http://www.flickr.com/photos/britishlibrary/11003571745	003842704	Memoirs relating to European and Asiatic Turkey; edited from manuscript journals, by R. Walpole. (Travels in various countries of the East; being a continuation of Memoirs relating to European and Asiatic Turkey, &c.)	WALPOLE, Robert Rev	London	Longman & Co.	1817	0	000606	1	ark:/81055/vdc_000000056766	lsidyv3c13e360
11003665466	http://www.flickr.com/photos/britishlibrary/11003665466	002011198	[Travels in Brazil.]	KOSTER, Henry.	London		1817	0	000029	1		
11003663806	http://www.flickr.com/photos/britishlibrary/11003663806	002322267	A new and complete System of Modern Geography ... With a brief sketch of the origin, history, and antiquities of each nation. Illustrated, etc	Mackenzie, E. (Eneas)	Newcastle upon Tyne	Mackenzie & Dent	1817	02	000686	1	ark:/81055/vdc_00000005C838	lsidyv3ca38433
11003791913	http://www.flickr.com/photos/britishlibrary/11003791913	003842704	Memoirs relating to European and Asiatic Turkey; edited from manuscript journals, by R. Walpole. (Travels in various countries of the East; being a continuation of Memoirs relating to European and Asiatic Turkey, &c.)	WALPOLE, Robert Rev	London	Longman & Co.	1817	02	000657	1	ark:/81055/vdc_000000056766	lsidyv3c13e360
11003790643	http://www.flickr.com/photos/britishlibrary/11003790643	003842704	Memoirs relating to European and Asiatic Turkey; edited from manuscript journals, by R. Walpole. (Travels in various countries of the East; being a continuation of Memoirs relating to European and Asiatic Turkey, &c.)	WALPOLE, Robert Rev	London	Longman & Co.	1817	01	000581	1	ark:/81055/vdc_000000056766	lsidyv3c13e360
