volume	publisher	title	first_author	BL_DLS_ID	pubplace	book_identifier	ARK_id_of_book	date	flickr_url	image_idx	page	flickr_id	flickr_small_source	flickr_small_height	flickr_small_width	flickr_medium_source	flickr_medium_height	flickr_medium_width	flickr_large_source	flickr_large_height	flickr_large_width	flickr_original_source	flickr_original_height	flickr_original_width
12		Algemeene geschiedenis der Vaderlands, van de vroegste tijden tot op heden. (dl. 3. stuk 2. Voortgezet door Mr. O. van Rees. dl. 3. stuk 3-5. Voortgezet door Mr. O. van Rees en Dr. W. G. Brill. dl. 4, 5. Voortgezet door Dr. J. van Vloten.) dl. 1-dl. 5. stuk 1	AREND, Johannes Pieter.		Amsterdam	000107307		1840	http://www.flickr.com/photos/britishlibrary/11046934895	1	000077	11046934895	http://farm8.staticflickr.com/7296/11046934895_473befbb93_m.jpg	240	155	http://farm8.staticflickr.com/7296/11046934895_473befbb93.jpg	500	324	http://farm8.staticflickr.com/7296/11046934895_473befbb93_b.jpg	1024	663	http://farm8.staticflickr.com/7296/11046934895_fca5b476e9_o.jpg	3046	1972
0		Die Stadtpfarrkirche zu Unserer lieben schönen Fracu in Ingolstadt. Monographie, etc	GERSTNER, Franz Joseph von.		Ingolstadt	001407847		1840	http://www.flickr.com/photos/britishlibrary/11046933395	1	000009	11046933395	http://farm6.staticflickr.com/5532/11046933395_a2688e6a86_m.jpg	240	184	http://farm6.staticflickr.com/5532/11046933395_a2688e6a86.jpg	500	383	http://farm6.staticflickr.com/5532/11046933395_a2688e6a86_b.jpg	1024	784	http://farm6.staticflickr.com/5532/11046933395_4d5056f48b_o.jpg	1912	1463
11		Algemeene geschiedenis der Vaderlands, van de vroegste tijden tot op heden. (dl. 3. stuk 2. Voortgezet door Mr. O. van Rees. dl. 3. stuk 3-5. Voortgezet door Mr. O. van Rees en Dr. W. G. Brill. dl. 4, 5. Voortgezet door Dr. J. van Vloten.) dl. 1-dl. 5. stuk 1	AREND, Johannes Pieter.		Amsterdam	000107307		1840	http://www.flickr.com/photos/britishlibrary/11018305485	1	000392	11018305485	http://farm6.staticflickr.com/5478/11018305485_fc00993235_m.jpg	240	161	http://farm6.staticflickr.com/5478/11018305485_fc00993235.jpg	500	336	http://farm6.staticflickr.com/5478/11018305485_fc00993235_b.jpg	1024	689	http://farm6.staticflickr.com/5478/11018305485_a55ae2afde_o.jpg	2955	1987
0		C. Frommel's pittoreskes Italien. Nach dessen Original-Gemälden und Zeichnungen. Die Scenen aus dem Volksleben nach Zeichnungen von Catel, Gail, Goetzloff, Mosbrugger, Weller, Pinelli, etc. In Stahl gestochen von C. Frommel und H. Winkler. Text für Ober-Italien von W. von Lüdemann, Unter-Italien von C. Witte, etc	LUEDEMANN, Wilhelm von.		Leipzig	002280816		1840	http://www.flickr.com/photos/britishlibrary/11018396166	1	000779	11018396166	http://farm8.staticflickr.com/7346/11018396166_023d49371a_m.jpg	240	147	http://farm8.staticflickr.com/7346/11018396166_023d49371a.jpg	500	306	http://farm8.staticflickr.com/7346/11018396166_023d49371a_b.jpg	1024	627	http://farm8.staticflickr.com/7346/11018396166_90a373d9a4_o.jpg	2361	1446
03		Algemeene geschiedenis der Vaderlands, van de vroegste tijden tot op heden. (dl. 3. stuk 2. Voortgezet door Mr. O. van Rees. dl. 3. stuk 3-5. Voortgezet door Mr. O. van Rees en Dr. W. G. Brill. dl. 4, 5. Voortgezet door Dr. J. van Vloten.) dl. 1-dl. 5. stuk 1	AREND, Johannes Pieter.		Amsterdam	000107307		1840	http://www.flickr.com/photos/britishlibrary/11018464614	1	000363	11018464614	http://farm8.staticflickr.com/7317/11018464614_4a113f080e_m.jpg	240	199	http://farm8.staticflickr.com/7317/11018464614_4a113f080e.jpg	500	415	http://farm8.staticflickr.com/7317/11018464614_4a113f080e_b.jpg	1024	850	http://farm8.staticflickr.com/7317/11018464614_7ee6e53391_o.jpg	2392	1985
03		Vaterländische Immortellen aus dem Gebiete der österreichischen Geschichte der alten, mittleren, neuern und neuesten Zeit gesammelt und mit einer ... Bilderschau der merkwürdigsten Handlungen ausgezeichneter Personen ... ausgestattet	ZIEGLER, Anton Historical Writer		Wien	004020133		1840	http://www.flickr.com/photos/britishlibrary/11018393616	1	000076	11018393616	http://farm3.staticflickr.com/2849/11018393616_3e323f46d1_m.jpg	240	182	http://farm3.staticflickr.com/2849/11018393616_3e323f46d1.jpg	500	378	http://farm3.staticflickr.com/2849/11018393616_3e323f46d1_b.jpg	1024	775	http://farm3.staticflickr.com/2849/11018393616_0f9280d1eb_o.jpg	2635	1995
02	George Virtue	The Poems, Letters, and Land of Robert Burns: illustrated by W. H. Bartlett, T. Allom, and other artists. With a new memoir of the poet, and notices, critical and biographical, of his works, by Allan Cunningham	Burns, Robert		London	000543172		1840	http://www.flickr.com/photos/britishlibrary/11018463484	1	000262	11018463484	http://farm8.staticflickr.com/7373/11018463484_9168b99a7c_m.jpg	240	181	http://farm8.staticflickr.com/7373/11018463484_9168b99a7c.jpg	500	376	http://farm8.staticflickr.com/7373/11018463484_9168b99a7c_b.jpg	1024	771	http://farm8.staticflickr.com/7373/11018463484_00662143b6_o.jpg	2132	1606
02		Algemeene geschiedenis der Vaderlands, van de vroegste tijden tot op heden. (dl. 3. stuk 2. Voortgezet door Mr. O. van Rees. dl. 3. stuk 3-5. Voortgezet door Mr. O. van Rees en Dr. W. G. Brill. dl. 4, 5. Voortgezet door Dr. J. van Vloten.) dl. 1-dl. 5. stuk 1	AREND, Johannes Pieter.		Amsterdam	000107307		1840	http://www.flickr.com/photos/britishlibrary/11018392446	1	000066	11018392446	http://farm3.staticflickr.com/2888/11018392446_4f8f611f10_m.jpg	240	189	http://farm3.staticflickr.com/2888/11018392446_4f8f611f10.jpg	500	393	http://farm3.staticflickr.com/2888/11018392446_4f8f611f10_b.jpg	1024	805	http://farm3.staticflickr.com/2888/11018392446_3507e5d032_o.jpg	2575	2024
01		Путешествіе по Египту и Нубіи въ 1834-1835 г. ... служащее дополненіемъ къ путешествію по святой землѣ. [With plates and map.]	NOROV, Avraam Sergyeevich.		Санктпетербургъ	002671224		1840	http://www.flickr.com/photos/britishlibrary/11018301915	1	000009	11018301915	http://farm8.staticflickr.com/7431/11018301915_4f8f611f10_m.jpg	240	169	http://farm8.staticflickr.com/7431/11018301915_4f8f611f10.jpg	500	352	http://farm8.staticflickr.com/7431/11018301915_4f8f611f10_b.jpg	1024	720	http://farm8.staticflickr.com/7431/11018301915_0613e4c85c_o.jpg	2201	1547
0	A. Fullarton & Co.	Select Views of the Royal Palaces of Scotland ... With illustrative descriptions ... by the late Rev. John Jamieson ... Second edition	BROWN, William Secretary to the Literary and Antiquarian Society of Perth		Glasgow	000496625		1840	http://www.flickr.com/photos/britishlibrary/11018521403	1	000087	11018521403	http://farm6.staticflickr.com/5540/11018521403_5e44407525_m.jpg	240	170	http://farm6.staticflickr.com/5540/11018521403_5e44407525.jpg	500	354	http://farm6.staticflickr.com/5540/11018521403_5e44407525_b.jpg	1024	726	http://farm6.staticflickr.com/5540/11018521403_6174200359_o.jpg	2152	1525
0		Cartas Mejicanas. ... Segunda edicion, etc	MOXÓ Y DE FRANCOLÍ, Benito María de Archbishop of La Plata		Genova	002570681		1840	http://www.flickr.com/photos/britishlibrary/11018520623	1	000147	11018520623	http://farm8.staticflickr.com/7420/11018520623_bfa71ff05c_m.jpg	240	157	http://farm8.staticflickr.com/7420/11018520623_bfa71ff05c.jpg	500	327	http://farm8.staticflickr.com/7420/11018520623_bfa71ff05c_b.jpg	1024	670	http://farm8.staticflickr.com/7420/11018520623_be004556f9_o.jpg	1929	1263
14		Algemeene geschiedenis der Vaderlands, van de vroegste tijden tot op heden. (dl. 3. stuk 2. Voortgezet door Mr. O. van Rees. dl. 3. stuk 3-5. Voortgezet door Mr. O. van Rees en Dr. W. G. Brill. dl. 4, 5. Voortgezet door Dr. J. van Vloten.) dl. 1-dl. 5. stuk 1	AREND, Johannes Pieter.		Amsterdam	000107307		1840	http://www.flickr.com/photos/britishlibrary/11018389276	1	000105	11018389276	http://farm8.staticflickr.com/7333/11018389276_1cbfe79dfc_m.jpg	240	165	http://farm8.staticflickr.com/7333/11018389276_1cbfe79dfc.jpg	500	343	http://farm8.staticflickr.com/7333/11018389276_1cbfe79dfc_b.jpg	1024	703	http://farm8.staticflickr.com/7333/11018389276_b648c1ce75_o.jpg	3037	2086
0		Dijon ancien et moderne. Recherches historiques tirées de monumens contemporains ... Illustré par E. Sagot	MAILLARD DE CHAMBURE, Charles Hyacinthe.		Dijon	002346736		1840	http://www.flickr.com/photos/britishlibrary/11018298385	1	000097	11018298385	http://farm4.staticflickr.com/3775/11018298385_2c1f443568_m.jpg	240	157	http://farm4.staticflickr.com/3775/11018298385_2c1f443568.jpg	500	327	http://farm4.staticflickr.com/3775/11018298385_2c1f443568_b.jpg	1024	670	http://farm4.staticflickr.com/3775/11018298385_9e55f495eb_o.jpg	2601	1702
04		Algemeene geschiedenis der Vaderlands, van de vroegste tijden tot op heden. (dl. 3. stuk 2. Voortgezet door Mr. O. van Rees. dl. 3. stuk 3-5. Voortgezet door Mr. O. van Rees en Dr. W. G. Brill. dl. 4, 5. Voortgezet door Dr. J. van Vloten.) dl. 1-dl. 5. stuk 1	AREND, Johannes Pieter.		Amsterdam	000107307		1840	http://www.flickr.com/photos/britishlibrary/11018296205	1	000563	11018296205	http://farm4.staticflickr.com/3824/11018296205_82f4a6a17a_m.jpg	240	154	http://farm4.staticflickr.com/3824/11018296205_82f4a6a17a.jpg	500	321	http://farm4.staticflickr.com/3824/11018296205_82f4a6a17a_b.jpg	1024	658	http://farm4.staticflickr.com/3824/11018296205_90ba72cb39_o.jpg	3092	1987
0		Cæsarea. The Island of Jersey; its history, constitution, ... commerce, and other statistics ... To which is added, its antiquities, and the biography of eminent men, natives of the Island			London	001866968		1840	http://www.flickr.com/photos/britishlibrary/11018457694	1	000239	11018457694	http://farm8.staticflickr.com/7291/11018457694_7f9a3bde5f_m.jpg	240	131	http://farm8.staticflickr.com/7291/11018457694_7f9a3bde5f.jpg	500	273	http://farm8.staticflickr.com/7291/11018457694_7f9a3bde5f_b.jpg	1024	560	http://farm8.staticflickr.com/7291/11018457694_003e2b5c6e_o.jpg	2126	1162
01		Narrative of a Voyage to Madeira, Teneriffe, and along the Shores of the Mediterranean, including a visit to Algiers, Egypt, Palestine ... Cyprus, and Greece. With observations on the present state and prospects of Egypt and Palestine, and on the climate, natural history, antiquities, etc. of the countries visited	WILDE, William Robert Wills Sir		Dublin	003923887		1840	http://www.flickr.com/photos/britishlibrary/11018516513	1	000008	11018516513	http://farm8.staticflickr.com/7392/11018516513_464fbd1b43_m.jpg	240	146	http://farm8.staticflickr.com/7392/11018516513_464fbd1b43.jpg	500	305	http://farm8.staticflickr.com/7392/11018516513_464fbd1b43_b.jpg	1024	625	http://farm8.staticflickr.com/7392/11018516513_5e150ac0a9_o.jpg	2307	1408
0	Thomas Tegg	Sketches in London ... Second edition	GRANT, James Editor of the “Morning Advertiser.”	lsidyv3bdaf0a3	London	001488075	ark:/81055/vdc_000000054C8A	1840	http://www.flickr.com/photos/britishlibrary/11018455394	1	000379	11018455394	http://farm3.staticflickr.com/2850/11018455394_39e83a02b7_m.jpg	240	202	http://farm3.staticflickr.com/2850/11018455394_39e83a02b7.jpg	500	421	http://farm3.staticflickr.com/2850/11018455394_39e83a02b7_b.jpg	1024	863	http://farm3.staticflickr.com/2850/11018455394_ab3d2c85eb_o.jpg	1690	1424
0		Dijon ancien et moderne. Recherches historiques tirées de monumens contemporains ... Illustré par E. Sagot	MAILLARD DE CHAMBURE, Charles Hyacinthe.		Dijon	002346736		1840	http://www.flickr.com/photos/britishlibrary/11018515313	1	000065	11018515313	http://farm4.staticflickr.com/3832/11018515313_59260e2818_m.jpg	240	156	http://farm4.staticflickr.com/3832/11018515313_59260e2818.jpg	500	325	http://farm4.staticflickr.com/3832/11018515313_59260e2818_b.jpg	1024	666	http://farm4.staticflickr.com/3832/11018515313_0b06d6b31d_o.jpg	2632	1713
10		Algemeene geschiedenis der Vaderlands, van de vroegste tijden tot op heden. (dl. 3. stuk 2. Voortgezet door Mr. O. van Rees. dl. 3. stuk 3-5. Voortgezet door Mr. O. van Rees en Dr. W. G. Brill. dl. 4, 5. Voortgezet door Dr. J. van Vloten.) dl. 1-dl. 5. stuk 1	AREND, Johannes Pieter.		Amsterdam	000107307		1840	http://www.flickr.com/photos/britishlibrary/11018383486	1	000776	11018383486	http://farm8.staticflickr.com/7342/11018383486_d83b63640f_m.jpg	240	155	http://farm8.staticflickr.com/7342/11018383486_d83b63640f.jpg	500	322	http://farm8.staticflickr.com/7342/11018383486_d83b63640f_b.jpg	1024	660	http://farm8.staticflickr.com/7342/11018383486_36f8892872_o.jpg	3150	2030
0		A History and description of the Hospital of St. Cross ... with a list of the Masters ... With an engraving, etc	MOODY, Henry Curator of the Winchester Museum		Winchester	002537076		1840	http://www.flickr.com/photos/britishlibrary/11018512313	1	000040	11018512313	http://farm4.staticflickr.com/3768/11018512313_0cc1363fa5_m.jpg	240	147	http://farm4.staticflickr.com/3768/11018512313_0cc1363fa5.jpg	500	306	http://farm4.staticflickr.com/3768/11018512313_0cc1363fa5_b.jpg	1024	626	http://farm4.staticflickr.com/3768/11018512313_43daf93122_o.jpg	2285	1398
0	Hauman & Co.	A Descriptive Tour in Scotland. By T. H. C. [i.e. Chauncy H. Townshend.]	C., T. H.		Brussels	000561560		1840	http://www.flickr.com/photos/britishlibrary/11018381706	1	000095	11018381706	http://farm4.staticflickr.com/3693/11018381706_d186d315cd_m.jpg	240	150	http://farm4.staticflickr.com/3693/11018381706_d186d315cd.jpg	500	313	http://farm4.staticflickr.com/3693/11018381706_d186d315cd_b.jpg	1024	642	http://farm4.staticflickr.com/3693/11018381706_ae5d34db4f_o.jpg	2317	1453
01		Essai sur l'histoire de la Franche-Comté. [With plates and genealogical tables.]	CLERC, Édouard Président à la Cour d'Appel de Besançon		Besançon	000723314		1840	http://www.flickr.com/photos/britishlibrary/11018510493	1	000107	11018510493	http://farm4.staticflickr.com/3713/11018510493_02bf126af6_m.jpg	92	240	http://farm4.staticflickr.com/3713/11018510493_02bf126af6.jpg	192	500	http://farm4.staticflickr.com/3713/11018510493_02bf126af6_b.jpg	394	1024	http://farm4.staticflickr.com/3713/11018510493_b83083e4dd_o.jpg	2539	6606
0		Description des hordes et des steppes des Kirghiz-Kazaks, ou Kirghiz-Kaïssaks, ... traduite du Russe par Ferry de Pigny, revue et publiée par E. Charrière	LEVSHIN, Aleksyei Iraklievich.		Paris	002153345		1840	http://www.flickr.com/photos/britishlibrary/11018289795	1	000537	11018289795	http://farm8.staticflickr.com/7353/11018289795_4fc7405c4c_m.jpg	240	88	http://farm8.staticflickr.com/7353/11018289795_4fc7405c4c.jpg	500	184	http://farm8.staticflickr.com/7353/11018289795_4fc7405c4c_b.jpg	1024	376	http://farm8.staticflickr.com/7353/11018289795_cdd703a666_o.jpg	2557	938
0		A personal narrative of a visit to Ghuzni, Kabul, and Afghanistan, and of a residence at the Court of Dost Mohamed. With notices of Runjit Sing, Khiva, and the Russian expedition ... With illustrations, etc	VIGNE, Godfrey Thomas.	lsidyv3c63e670	London	003792189	ark:/81055/vdc_00000005A792	1840	http://www.flickr.com/photos/britishlibrary/11018449594	1	000149	11018449594	http://farm8.staticflickr.com/7356/11018449594_2a5ea09a8d_m.jpg	240	149	http://farm8.staticflickr.com/7356/11018449594_2a5ea09a8d.jpg	500	311	http://farm8.staticflickr.com/7356/11018449594_2a5ea09a8d_b.jpg	1024	637	http://farm8.staticflickr.com/7356/11018449594_3185ba903b_o.jpg	2275	1416
0		Geographical and statistical memoir of the Konkun. The revenue and land tenures of the western part of India, considered with reference to their first institution and present working. Re-printed from the Journal of the Bombay Geographical Society for May, 1840	JERVIS, Thomas Best.	lsidyv32c285dc	Calcutta	001867492	ark:/81055/vdc_000000052644	1840	http://www.flickr.com/photos/britishlibrary/11018378786	1	000149	11018378786	http://farm8.staticflickr.com/7389/11018378786_85b6ef96bf_m.jpg	240	134	http://farm8.staticflickr.com/7389/11018378786_85b6ef96bf.jpg	500	279	http://farm8.staticflickr.com/7389/11018378786_85b6ef96bf_b.jpg	1024	572	http://farm8.staticflickr.com/7389/11018378786_24339f7f32_o.jpg	2320	1297
13		Algemeene geschiedenis der Vaderlands, van de vroegste tijden tot op heden. (dl. 3. stuk 2. Voortgezet door Mr. O. van Rees. dl. 3. stuk 3-5. Voortgezet door Mr. O. van Rees en Dr. W. G. Brill. dl. 4, 5. Voortgezet door Dr. J. van Vloten.) dl. 1-dl. 5. stuk 1	AREND, Johannes Pieter.		Amsterdam	000107307		1840	http://www.flickr.com/photos/britishlibrary/11018287385	1	000009	11018287385	http://farm8.staticflickr.com/7418/11018287385_2bdcb462fa_m.jpg	228	240	http://farm8.staticflickr.com/7418/11018287385_2bdcb462fa.jpg	475	500	http://farm8.staticflickr.com/7418/11018287385_2bdcb462fa_b.jpg	972	1024	http://farm8.staticflickr.com/7418/11018287385_5e3cc92e64_o.jpg	1808	1905
0		An endeavour to classify the sepulchral remains in Northamptonshire; or, a discourse on funeral monuments, in that country, etc	HARTSHORNE, Charles Henry.	lsidyv3bae898f	Cambridge	001609698	ark:/81055/vdc_000000053184	1840	http://www.flickr.com/photos/britishlibrary/11018287075	1	000059	11018287075	http://farm4.staticflickr.com/3809/11018287075_83477b5781_m.jpg	240	103	http://farm4.staticflickr.com/3809/11018287075_83477b5781.jpg	500	214	http://farm4.staticflickr.com/3809/11018287075_83477b5781_b.jpg	1024	438	http://farm4.staticflickr.com/3809/11018287075_370c13c4d6_o.jpg	2223	951
02	A. Fullarton & Co.	[A History of the Highlands and of the Highland Clans ... Illustrated by a series of portraits and other engravings. [With a map.]]	BROWNE, James LL.D., Advocate		Glasgow	000497869		1840	http://www.flickr.com/photos/britishlibrary/11018376626	1	000030	11018376626	http://farm8.staticflickr.com/7303/11018376626_1e2a391ebb_m.jpg	240	211	http://farm8.staticflickr.com/7303/11018376626_1e2a391ebb.jpg	500	440	http://farm8.staticflickr.com/7303/11018376626_1e2a391ebb_b.jpg	1024	902	http://farm8.staticflickr.com/7303/11018376626_b5ac26b8e9_o.jpg	1647	1450
01		The City of the Magyar, or Hungary and her institutions in 1839-40	Pardoe, (Julia) Miss		London	002765886		1840	http://www.flickr.com/photos/britishlibrary/11018446794	1	000111	11018446794	http://farm4.staticflickr.com/3678/11018446794_edecffa251_m.jpg	240	143	http://farm4.staticflickr.com/3678/11018446794_edecffa251.jpg	500	297	http://farm4.staticflickr.com/3678/11018446794_edecffa251_b.jpg	1024	609	http://farm4.staticflickr.com/3678/11018446794_919a28e771_o.jpg	1931	1149
0		Colonia Sumlocenne. Rottenberg am Neckar unter den Römern. Mit Rücksicht auf das Zehentland und Germanien überhaupt. Ein antiquarisch-topographischer Versuch	JAUMANN, Ignatius von.		Stuttgart & Tübingen	001856463		1840	http://www.flickr.com/photos/britishlibrary/11018284725	1	000327	11018284725	http://farm6.staticflickr.com/5475/11018284725_454bf03715_m.jpg	240	139	http://farm6.staticflickr.com/5475/11018284725_454bf03715.jpg	500	290	http://farm6.staticflickr.com/5475/11018284725_454bf03715_b.jpg	1024	593	http://farm6.staticflickr.com/5475/11018284725_ba7e71d7e0_o.jpg	2414	1398
03	A. Fullarton & Co.	[A History of the Highlands and of the Highland Clans ... Illustrated by a series of portraits and other engravings. [With a map.]]	BROWNE, James LL.D., Advocate		Glasgow	000497869		1840	http://www.flickr.com/photos/britishlibrary/11018283665	1	000022	11018283665	http://farm8.staticflickr.com/7307/11018283665_5f2dec60f7_m.jpg	240	130	http://farm8.staticflickr.com/7307/11018283665_5f2dec60f7.jpg	500	271	http://farm8.staticflickr.com/7307/11018283665_5f2dec60f7_b.jpg	1024	556	http://farm8.staticflickr.com/7307/11018283665_829f56772e_o.jpg	2591	1406
02		Путешествіе по Египту и Нубіи въ 1834-1835 г. ... служащее дополненіемъ къ путешествію по святой землѣ. [With plates and map.]	NOROV, Avraam Sergyeevich.		Санктпетербургъ	002671224		1840	http://www.flickr.com/photos/britishlibrary/11018374836	1	000136	11018374836	http://farm6.staticflickr.com/5547/11018374836_963bc06075_m.jpg	240	149	http://farm6.staticflickr.com/5547/11018374836_963bc06075.jpg	500	311	http://farm6.staticflickr.com/5547/11018374836_963bc06075_b.jpg	1024	637	http://farm6.staticflickr.com/5547/11018374836_36bb79eb9a_o.jpg	2222	1383
0	A. Fullarton & Co.	Select Views of the Royal Palaces of Scotland ... With illustrative descriptions ... by the late Rev. John Jamieson ... Second edition	BROWN, William Secretary to the Literary and Antiquarian Society of Perth		Glasgow	000496625		1840	http://www.flickr.com/photos/britishlibrary/11018443684	1	000051	11018443684	http://farm4.staticflickr.com/3677/11018443684_168354c99d_m.jpg	240	177	http://farm4.staticflickr.com/3677/11018443684_168354c99d.jpg	500	368	http://farm4.staticflickr.com/3677/11018443684_168354c99d_b.jpg	1024	754	http://farm4.staticflickr.com/3677/11018443684_dc5f028041_o.jpg	1973	1452
0		Colonia Sumlocenne. Rottenberg am Neckar unter den Römern. Mit Rücksicht auf das Zehentland und Germanien überhaupt. Ein antiquarisch-topographischer Versuch	JAUMANN, Ignatius von.		Stuttgart & Tübingen	001856463		1840	http://www.flickr.com/photos/britishlibrary/11018373046	1	000012	11018373046	http://farm6.staticflickr.com/5542/11018373046_d8c038683d_m.jpg	83	240	http://farm6.staticflickr.com/5542/11018373046_d8c038683d.jpg	172	500	http://farm6.staticflickr.com/5542/11018373046_d8c038683d_b.jpg	352	1024	http://farm6.staticflickr.com/5542/11018373046_3317d82e86_o.jpg	2115	6151
02		Vaterländische Immortellen aus dem Gebiete der österreichischen Geschichte der alten, mittleren, neuern und neuesten Zeit gesammelt und mit einer ... Bilderschau der merkwürdigsten Handlungen ausgezeichneter Personen ... ausgestattet	ZIEGLER, Anton Historical Writer		Wien	004020133		1840	http://www.flickr.com/photos/britishlibrary/11018371806	1	000156	11018371806	http://farm8.staticflickr.com/7384/11018371806_cfe0713e0e_m.jpg	240	183	http://farm8.staticflickr.com/7384/11018371806_cfe0713e0e.jpg	500	380	http://farm8.staticflickr.com/7384/11018371806_cfe0713e0e_b.jpg	1024	779	http://farm8.staticflickr.com/7384/11018371806_431b374427_o.jpg	2610	1985
01		Vaterländische Immortellen aus dem Gebiete der österreichischen Geschichte der alten, mittleren, neuern und neuesten Zeit gesammelt und mit einer ... Bilderschau der merkwürdigsten Handlungen ausgezeichneter Personen ... ausgestattet	ZIEGLER, Anton Historical Writer		Wien	004020133		1840	http://www.flickr.com/photos/britishlibrary/11018500583	1	000214	11018500583	http://farm8.staticflickr.com/7402/11018500583_ae3f216ab5_m.jpg	240	185	http://farm8.staticflickr.com/7402/11018500583_ae3f216ab5.jpg	500	386	http://farm8.staticflickr.com/7402/11018500583_ae3f216ab5_b.jpg	1024	791	http://farm8.staticflickr.com/7402/11018500583_07b2cf7dde_o.jpg	2683	2072
0		Paris et ses environs, reproduits par le daguerréotype, sous la direction de M. C. Philipon, etc. [With descriptive letterpress by V. Ratier, A. Auvial, and others.]	RATIER, Victor.		Paris	003044262		1840	http://www.flickr.com/photos/britishlibrary/11018369826	1	000109	11018369826	http://farm8.staticflickr.com/7371/11018369826_9d539da60a_m.jpg	240	171	http://farm8.staticflickr.com/7371/11018369826_9d539da60a.jpg	500	357	http://farm8.staticflickr.com/7371/11018369826_9d539da60a_b.jpg	1024	731	http://farm8.staticflickr.com/7371/11018369826_a55becfc80_o.jpg	3044	2173
0		Turkey and the Turks; being the present state of the Ottoman Empire	REID, John of Glasgow	lsidyv3c997c78	London	003065570	ark:/81055/vdc_00000005C292	1840	http://www.flickr.com/photos/britishlibrary/11018439474	1	000115	11018439474	http://farm3.staticflickr.com/2809/11018439474_d834817cfe_m.jpg	240	147	http://farm3.staticflickr.com/2809/11018439474_d834817cfe.jpg	500	307	http://farm3.staticflickr.com/2809/11018439474_d834817cfe_b.jpg	1024	629	http://farm3.staticflickr.com/2809/11018439474_d2d1da0cf1_o.jpg	2163	1328
0		C. Frommel's pittoreskes Italien. Nach dessen Original-Gemälden und Zeichnungen. Die Scenen aus dem Volksleben nach Zeichnungen von Catel, Gail, Goetzloff, Mosbrugger, Weller, Pinelli, etc. In Stahl gestochen von C. Frommel und H. Winkler. Text für Ober-Italien von W. von Lüdemann, Unter-Italien von C. Witte, etc	LUEDEMANN, Wilhelm von.		Leipzig	002280816		1840	http://www.flickr.com/photos/britishlibrary/11018368476	1	000075	11018368476	http://farm4.staticflickr.com/3670/11018368476_8610b0b565_m.jpg	240	149	http://farm4.staticflickr.com/3670/11018368476_8610b0b565.jpg	500	311	http://farm4.staticflickr.com/3670/11018368476_8610b0b565_b.jpg	1024	636	http://farm4.staticflickr.com/3670/11018368476_834a787c21_o.jpg	2328	1446
0		A Summer in Brittany ... Edited by Frances Trollope	TROLLOPE, Thomas Adolphus.	lsidyv3bdfd8fd	London	003678867	ark:/81055/vdc_000000054FC6	1840	http://www.flickr.com/photos/britishlibrary/11018437874	1	000834	11018437874	http://farm8.staticflickr.com/7360/11018437874_758a0f032d_m.jpg	240	137	http://farm8.staticflickr.com/7360/11018437874_758a0f032d.jpg	500	286	http://farm8.staticflickr.com/7360/11018437874_758a0f032d_b.jpg	1024	585	http://farm8.staticflickr.com/7360/11018437874_f06bbd95bf_o.jpg	2242	1280
0		Voyage à Madagascar et aux Iles Comores (1823 à 1830), précédé d'une notice historique et géographique sur Madagascar par M. E. de Froberville ... Avec un atlas et huit vues et costumes dessinés par V. Adam et deux cartes géographiques	LEGUÉVEL DE LACOMBE, B. F.		Paris	002118653		1840	http://www.flickr.com/photos/britishlibrary/11018367206	1	000667	11018367206	http://farm4.staticflickr.com/3730/11018367206_9f85aa8fd1_m.jpg	240	139	http://farm4.staticflickr.com/3730/11018367206_9f85aa8fd1.jpg	500	289	http://farm4.staticflickr.com/3730/11018367206_9f85aa8fd1_b.jpg	1024	592	http://farm4.staticflickr.com/3730/11018367206_0d3c8240e7_o.jpg	2298	1328
